{
  "schemaVersion": 2,
  "generatedBy": "scripts/generate-plugin-compatibility-registry.mjs",
  "threadleafVersion": "0.1.0",
  "entries": [
    {
      "plugin": {
        "id": "calendar-beta",
        "name": "Calendar (Beta)",
        "version": "2.0.0",
        "repository": "https://github.com/liamcain/obsidian-calendar-plugin",
        "license": "MIT",
        "bundleSha256": "64d1c6c620803246724bc922c5c2e0a17c406ffc23f6bbcfbfb14c643958fbb7"
      },
      "threadleafVersion": "0.1.0",
      "lastTested": "2026-08-20",
      "compatibilityLevel": 3,
      "summary": "The exact official Calendar 2.0.0-beta.2 release passed reviewed authority, mounted its unchanged month grid in Threadleaf's physical right dock beside an active note and a simultaneous plugin-owned main document, consumed Threadleaf's daily-note folder, format, and template settings, created and opened a templated daily note through its ordinary confirmation flow, updated the day marker, rendered in light and dark, and reconstructed the dock and marker after a full application restart while four other plugins remained loaded.",
      "evidenceMode": "direct",
      "requiredCapabilities": [
        "vault-read",
        "network",
        "filesystem",
        "subprocess",
        "host-environment",
        "workspace-ui",
        "dynamic-code"
      ],
      "platforms": [
        {
          "id": "linux-x64-electron",
          "status": "verified",
          "limits": [
            "Verified under Xvfb Electron with the exact official release, isolated plugin renderer, disposable vault, private settings, a physical 299 by 715 pixel dock, and visible light and dark screenshots.",
            "The runtime is trusted same-user desktop code, not a sandbox."
          ]
        },
        {
          "id": "macos-electron",
          "status": "unverified",
          "limits": ["This exact package workflow is not verified on macOS."]
        },
        {
          "id": "windows-x64-electron",
          "status": "unverified",
          "limits": ["This exact package workflow is not verified on Windows."]
        }
      ],
      "workflows": [
        {
          "id": "calendar.right-dock-daily-note-restart.v1",
          "name": "Mount the calendar beside a plugin-owned main document, create a templated daily note, update its marker, and reconstruct after restart",
          "status": "passed",
          "gates": [
            {
              "path": "scripts/check-excalidraw-roundtrip.mjs",
              "command": "THREADLEAF_INSTALLED_PLUGIN_MATRIX_ROOT=$PLUGIN_ROOT THREADLEAF_INSTALLED_THEME_MATRIX_ROOT=$MINIMAL_THEME pnpm test:excalidraw-roundtrip"
            },
            {
              "path": "src/runtime/obsidian-workspace-filemanager-compat.test.ts",
              "command": "pnpm exec vitest run src/runtime/obsidian-workspace-filemanager-compat.test.ts src/runtime/obsidian-internal-plugins.test.ts"
            }
          ]
        }
      ],
      "failures": [],
      "limitations": [
        "Weekly and monthly Periodic Notes integration, drag-and-drop placement, right-dock pop-outs, mutation from external filesystem events, and explicit plugin reload remain outside this exact workflow claim.",
        "Fold payloads are preserved for the live workflow but native editor fold rendering is not claimed.",
        "This is supporting behavior evidence, not Level 4 evidence.",
        "No controller-finalized signed production receipt exists for this tuple."
      ]
    },
    {
      "plugin": {
        "id": "data-files-editor",
        "name": "Data Files Editor",
        "version": "1.3.0",
        "repository": "https://github.com/zuktol/obsidian-data-files-editor",
        "license": "MIT",
        "bundleSha256": "1f962a44845adad7ea3de6792bbf536f111ee131b0fcd16fa9cf4d18ff0d0676"
      },
      "threadleafVersion": "0.1.0",
      "lastTested": "2026-08-20",
      "compatibilityLevel": 3,
      "summary": "The exact Obsidian-installed Data Files Editor 1.3.0 bundle passed reviewed authority, opened its registered JSON file view, accepted real CodeMirror input, autosaved the changed JSON bytes, restored that content after a full application restart, and exposed its settings surface while four installed plugins remained loaded together.",
      "evidenceMode": "direct",
      "requiredCapabilities": [
        "editor-extension",
        "workspace-ui",
        "network",
        "filesystem",
        "subprocess",
        "host-environment"
      ],
      "platforms": [
        {
          "id": "linux-x64-electron",
          "status": "verified",
          "limits": [
            "Verified under Xvfb Electron with the exact installed bundle, isolated plugin renderer, disposable vault, and private state.",
            "The runtime is trusted same-user desktop code, not a sandbox."
          ]
        },
        {
          "id": "macos-electron",
          "status": "unverified",
          "limits": ["This exact package workflow is not verified on macOS."]
        },
        {
          "id": "windows-x64-electron",
          "status": "unverified",
          "limits": ["This exact package workflow is not verified on Windows."]
        }
      ],
      "workflows": [
        {
          "id": "data-files-editor.json-open-edit-autosave.v1",
          "name": "Open, edit, and autosave JSON through the plugin-owned file view",
          "status": "passed",
          "gates": [
            {
              "path": "scripts/check-excalidraw-roundtrip.mjs",
              "command": "THREADLEAF_INSTALLED_PLUGIN_MATRIX_ROOT=$PLUGIN_ROOT THREADLEAF_INSTALLED_THEME_MATRIX_ROOT=$MINIMAL_THEME pnpm test:excalidraw-roundtrip"
            }
          ]
        }
      ],
      "failures": [],
      "limitations": [
        "YAML, TXT, XML, non-default settings, rename, and explicit plugin reload remain outside this exact workflow claim.",
        "This is supporting behavior evidence, not Level 4 evidence.",
        "No controller-finalized signed production receipt exists for this tuple."
      ]
    },
    {
      "plugin": {
        "id": "nldates-obsidian",
        "name": "Natural Language Dates",
        "version": "0.6.2",
        "repository": "https://github.com/argenos/nldates-obsidian",
        "license": "MIT",
        "bundleSha256": "387d36a43412f761c0c69320655a7ec09aa9189ae2267550224cacc861e63fd6"
      },
      "threadleafVersion": "0.1.0",
      "lastTested": "2026-08-20",
      "compatibilityLevel": 3,
      "summary": "The unchanged Natural Language Dates 0.6.2 release, byte-identical to the package installed in the acceptance vault, passed exact-package authority review and direct Linux Electron command-palette and editor-autosuggest workflows. Selected natural-language text and visible @to suggestions both produced the expected date link while eight commands and one editor suggest remained registered.",
      "evidenceMode": "direct",
      "requiredCapabilities": ["vault-read", "workspace-ui"],
      "platforms": [
        {
          "id": "linux-x64-electron",
          "status": "verified",
          "limits": [
            "Verified in Linux X11 and Xvfb Electron with the exact upstream and acceptance-vault bundle, a disposable vault, private state, and light and dark suggestion surfaces.",
            "The runtime is trusted same-user desktop code, not a sandbox."
          ]
        },
        {
          "id": "macos-electron",
          "status": "unverified",
          "limits": ["This exact package workflow is not verified on macOS."]
        },
        {
          "id": "windows-x64-electron",
          "status": "unverified",
          "limits": ["This exact package workflow is not verified on Windows."]
        }
      ],
      "workflows": [
        {
          "id": "natural-dates.command-palette-parse.v1",
          "name": "Parse selected natural-language text into a date link from the command palette",
          "status": "passed",
          "gates": [
            {
              "path": "scripts/check-url-selection-paste.mjs",
              "command": "pnpm test:natural-dates"
            },
            {
              "path": "src/runtime/plugin-host.test.ts",
              "command": "pnpm exec vitest run src/runtime/plugin-host.test.ts"
            }
          ]
        },
        {
          "id": "natural-dates.editor-autosuggest.v1",
          "name": "Type @to, navigate the visible date suggestions, and insert Tomorrow",
          "status": "passed",
          "gates": [
            {
              "path": "scripts/check-url-selection-paste.mjs",
              "command": "pnpm test:natural-dates"
            },
            {
              "path": "src/runtime/plugin-host.test.ts",
              "command": "pnpm exec vitest run src/runtime/plugin-host.test.ts src/runtime/isolated-plugin-runtime.test.ts"
            }
          ]
        }
      ],
      "failures": [],
      "limitations": [
        "Date Picker, the remaining date and time insertion commands, daily-note creation, Obsidian URI handling, non-default plugin settings, and cross-plugin daily-note settings are outside this claim.",
        "This is supporting behavior evidence, not Level 4 evidence.",
        "No controller-finalized signed production receipt exists for this tuple."
      ]
    },
    {
      "plugin": {
        "id": "obsidian-auto-link-title",
        "name": "Auto Link Title",
        "version": "1.5.5",
        "repository": "https://github.com/zolrath/obsidian-auto-link-title",
        "license": "MIT",
        "bundleSha256": "eb27498bfd05dc5c3847dd072f555ed4c02aece24451042c2edb25fc961f38be"
      },
      "threadleafVersion": "0.1.0",
      "lastTested": "2026-08-20",
      "compatibilityLevel": 3,